{
  "baselineId": "canonical-baseline.engineering-change-impact",
  "baselineVersion": "1.0.0",
  "agentContractVersion": "1.0.0",
  "ontologyVersion": "1.2.0",
  "dataVersion": "0.6.0",
  "scenario": {
    "id": "engineering-change-impact",
    "title": "Engineering Change Impact Analysis",
    "question": "What operations, quality controls, documents and release gates are affected by changing M220 from LeakTestProgram V3.4 to V3.5?",
    "intent": "engineering_change_impact",
    "seedEntityIds": [
      "machine.m220",
      "program.leak-test.v3-4",
      "program.leak-test.v3-5"
    ]
  },
  "ids": {
    "machine": {
      "m220": "machine.m220"
    },
    "operation": {
      "op30": "operation.op30"
    },
    "program": {
      "released": "program.leak-test.v3-4",
      "proposed": "program.leak-test.v3-5"
    },
    "change": {
      "m220V35": "engineering-change.m220-program-v3-5"
    }
  },
  "semanticAliases": {
    "machine.m220": [
      "M220",
      "leak test bench"
    ],
    "program.leak-test.v3-4": [
      "V3.4",
      "current program"
    ],
    "program.leak-test.v3-5": [
      "V3.5",
      "proposed program",
      "程序版本变更"
    ]
  },
  "entities": [
    {
      "id": "machine.m220",
      "type": "mfg:Machine",
      "label": "M220 Leak Test Bench",
      "description": "M220 Leak Test Bench",
      "domain": "engineering",
      "properties": {},
      "version": "1",
      "status": "active"
    },
    {
      "id": "operation.op30",
      "type": "mfg:Operation",
      "label": "OP30 Leak Test",
      "description": "OP30 Leak Test",
      "domain": "production",
      "properties": {},
      "version": "1",
      "status": "active"
    },
    {
      "id": "program.leak-test.v3-4",
      "type": "mfg:ProcessParameter",
      "label": "LeakTestProgram V3.4",
      "description": "LeakTestProgram V3.4",
      "domain": "engineering",
      "properties": {
        "releaseStatus": "released"
      },
      "version": "1",
      "status": "active"
    },
    {
      "id": "program.leak-test.v3-5",
      "type": "mfg:ProcessParameter",
      "label": "LeakTestProgram V3.5",
      "description": "LeakTestProgram V3.5",
      "domain": "engineering",
      "properties": {
        "releaseStatus": "proposed"
      },
      "version": "1",
      "status": "active"
    },
    {
      "id": "quality-characteristic.leak-rate",
      "type": "qual:QualityCharacteristic",
      "label": "Leak Rate",
      "description": "Leak Rate",
      "domain": "quality",
      "properties": {},
      "version": "1",
      "status": "active"
    },
    {
      "id": "engineering-change.m220-program-v3-5",
      "type": "eng:EngineeringChange",
      "label": "M220 Program V3.5 Engineering Change",
      "description": "M220 Program V3.5 Engineering Change",
      "domain": "engineering",
      "properties": {
        "changeStatus": "validation-required"
      },
      "version": "1",
      "status": "active"
    },
    {
      "id": "doc.engineering-change-request-m220-program",
      "type": "eng:EngineeringChangeRecord",
      "label": "Engineering Change Request M220 Program",
      "description": "Engineering Change Request M220 Program",
      "domain": "engineering",
      "properties": {},
      "version": "1",
      "status": "active"
    },
    {
      "id": "doc.validation-record-m220-program-v3-5",
      "type": "eng:ValidationRecord",
      "label": "Validation Record M220 Program V3.5",
      "description": "Validation Record M220 Program V3.5",
      "domain": "engineering",
      "properties": {
        "releaseDecision": "not-released"
      },
      "version": "1",
      "status": "active"
    },
    {
      "id": "document.control-plan.cp-bb01.rev-a",
      "type": "qual:ControlPlanVersion",
      "label": "Control Plan CP-BB01 Rev.A",
      "description": "Control Plan CP-BB01 Rev.A",
      "domain": "quality",
      "properties": {},
      "version": "1",
      "status": "active"
    },
    {
      "id": "document.sop.op30-leak-test",
      "type": "core:Document",
      "label": "SOP OP30 Leak Test",
      "description": "SOP OP30 Leak Test",
      "domain": "engineering",
      "properties": {},
      "version": "1",
      "status": "active"
    }
  ],
  "relations": [
    {
      "id": "relation.operation.op30.performed-on.machine.m220",
      "sourceId": "operation.op30",
      "targetId": "machine.m220",
      "label": "performedOn",
      "predicate": "mfg:executedBy",
      "properties": {},
      "assertionType": "asserted",
      "confidence": 1
    },
    {
      "id": "relation.operation.op30.uses-program.v3-4",
      "sourceId": "operation.op30",
      "targetId": "program.leak-test.v3-4",
      "label": "usesProgram",
      "predicate": "mfg:usesParameter",
      "properties": {},
      "assertionType": "asserted",
      "confidence": 1
    },
    {
      "id": "relation.change.m220-v3-5.affects.program.v3-5",
      "sourceId": "engineering-change.m220-program-v3-5",
      "targetId": "program.leak-test.v3-5",
      "label": "affects",
      "predicate": "eng:affects",
      "properties": {},
      "assertionType": "asserted",
      "confidence": 1
    },
    {
      "id": "relation.change.m220-v3-5.affects.operation.op30",
      "sourceId": "engineering-change.m220-program-v3-5",
      "targetId": "operation.op30",
      "label": "affects",
      "predicate": "eng:affects",
      "properties": {},
      "assertionType": "asserted",
      "confidence": 1
    },
    {
      "id": "relation.program.v3-5.requires-validation",
      "sourceId": "program.leak-test.v3-5",
      "targetId": "doc.validation-record-m220-program-v3-5",
      "label": "requiresValidation",
      "predicate": "eng:requiresValidation",
      "properties": {},
      "assertionType": "asserted",
      "confidence": 1
    },
    {
      "id": "relation.program.v3-5.supersedes.v3-4",
      "sourceId": "program.leak-test.v3-5",
      "targetId": "program.leak-test.v3-4",
      "label": "supersedes",
      "predicate": "core:supersedes",
      "properties": {},
      "assertionType": "asserted",
      "confidence": 1
    },
    {
      "id": "relation.operation.op30.controls.leak-rate",
      "sourceId": "operation.op30",
      "targetId": "quality-characteristic.leak-rate",
      "label": "controls",
      "predicate": "qual:controlsCharacteristic",
      "properties": {},
      "assertionType": "asserted",
      "confidence": 1
    },
    {
      "id": "relation.leak-rate.governed-by.control-plan",
      "sourceId": "quality-characteristic.leak-rate",
      "targetId": "document.control-plan.cp-bb01.rev-a",
      "label": "governedBy",
      "predicate": "qual:governedBy",
      "properties": {},
      "assertionType": "asserted",
      "confidence": 1
    },
    {
      "id": "relation.operation.op30.described-by.sop",
      "sourceId": "operation.op30",
      "targetId": "document.sop.op30-leak-test",
      "label": "describedBy",
      "predicate": "mfg:flowsTo",
      "properties": {},
      "assertionType": "asserted",
      "confidence": 1
    }
  ],
  "request": {
    "contractVersion": "1.0.0",
    "requestId": "canonical.engineering-change-impact.001",
    "scenarioId": "engineering-change-impact",
    "mode": "live",
    "language": "en",
    "message": "What operations, quality controls, documents and release gates are affected by changing M220 from LeakTestProgram V3.4 to V3.5?",
    "requestedAt": "2026-07-22T00:00:00.000Z"
  },
  "queryPlan": {
    "planId": "query-plan.engineering-change-impact.001",
    "planVersion": "1.0.0",
    "intent": "engineering_change_impact",
    "originalQuestion": "What operations, quality controls, documents and release gates are affected by changing M220 from LeakTestProgram V3.4 to V3.5?",
    "entities": [
      {
        "id": "machine.m220",
        "label": "M220 Leak Test Bench",
        "type": "mfg:Machine",
        "role": "subject"
      },
      {
        "id": "program.leak-test.v3-4",
        "label": "LeakTestProgram V3.4",
        "type": "mfg:ProcessParameter",
        "role": "subject"
      },
      {
        "id": "program.leak-test.v3-5",
        "label": "LeakTestProgram V3.5",
        "type": "mfg:ProcessParameter",
        "role": "subject"
      }
    ],
    "relationTypes": [
      "ontology.relationship.performed-on",
      "ontology.relationship.uses-program",
      "ontology.relationship.affects",
      "ontology.relationship.requires-validation",
      "ontology.relationship.controls",
      "ontology.relationship.governed-by",
      "ontology.relationship.described-by"
    ],
    "requestedFacets": [
      "engineering",
      "production",
      "quality",
      "governance"
    ],
    "constraints": [
      {
        "key": "entity.status",
        "operator": "eq",
        "value": "active"
      }
    ],
    "assumptions": [
      "V3.5 is a proposed demo change and V3.4 remains the released production baseline."
    ]
  },
  "graphQueryPlan": {
    "graphPlanId": "graph-query-plan.engineering-change-impact.001",
    "graphPlanVersion": "1.0.0",
    "semanticPlanId": "query-plan.engineering-change-impact.001",
    "intent": "engineering_change_impact",
    "templateId": "engineering-change-impact.dependency-scope.v1",
    "readOnly": true,
    "seedEntityIds": [
      "machine.m220",
      "program.leak-test.v3-4",
      "program.leak-test.v3-5"
    ],
    "allowedRelationTypes": [
      "performedOn",
      "usesProgram",
      "affects",
      "requiresValidation",
      "supersedes",
      "controls",
      "governedBy",
      "describedBy"
    ],
    "maxDepth": 3,
    "resultLimit": 80,
    "parameters": {
      "status": "active"
    }
  },
  "evidencePack": {
    "id": "evidence-pack.engineering-change-impact.001",
    "queryPlanId": "query-plan.engineering-change-impact.001",
    "generatedAt": "2026-07-22T00:00:00.000Z",
    "ontologyVersion": "1.2.0",
    "dataVersion": "0.6.0",
    "items": [
      {